{"$schema":"https://json-schema.org/draft/2020-12/schema","title":"ConstructionGate","type":"object","additionalProperties":false,"required":["schema_version","kind","status","construction_plan_sha256","scene_manifest_sha256","checks","human_review_required"],"properties":{"schema_version":{"const":"1.0"},"kind":{"const":"construction_gate"},"status":{"enum":["pass","needs_human_review","fail"]},"construction_plan_sha256":{"pattern":"^[a-f0-9]{64}$"},"scene_manifest_sha256":{"pattern":"^[a-f0-9]{64}$"},"checks":{"type":"array","minItems":1,"items":{"type":"object","required":["name","status","details"],"properties":{"name":{"type":"string"},"status":{"enum":["pass","needs_human_review","fail"]},"details":{"type":"object"}}}},"human_review_required":{"type":"boolean"}}}
